{
  "schema_version": "argus.d1-evidence-manifest/v2",
  "run_id": "ARGUS-20260811-BASE-R01",
  "fixture_id": "BEN-D1-OBS-001",
  "proof_kind": "plan",
  "run_window": {"start_utc": "2026-08-11T00:00:00Z", "end_utc": "2026-08-11T00:10:00Z"},
  "application_request_id": "d1-benign-request-0001",
  "planned_sources": ["alb", "nginx_modsecurity", "d0_envelope", "web", "was", "host", "flow_logs", "cloudtrail", "s3_getobject", "rds"],
  "records": []
}
